{
  "$schema": "../schema/stack-record.schema.json",
  "slug": "cursor",
  "company": "Cursor (Anysphere)",
  "website": "https://cursor.com",
  "sector": "ai-devtools",
  "size": "51-200",
  "as_of": "2025-06-10",
  "teardown_url": "/teardowns/cursor",
  "verified_by_company": false,
  "tools": [
    { "category": "language", "tool": "TypeScript", "status": "current", "notes": "Business logic, editor and backend monolith", "confidence": "confirmed", "evidence": [{ "url": "https://newsletter.pragmaticengineer.com/p/cursor", "type": "interview", "quote": "TypeScript: most business logic written in this language", "accessed": "2026-07-02" }] },
    { "category": "language", "tool": "Rust", "status": "current", "notes": "Performance-critical components incl. Anyrun orchestrator and indexing", "confidence": "confirmed", "evidence": [{ "url": "https://newsletter.pragmaticengineer.com/p/cursor", "type": "interview", "quote": "all performance-critical components use this language", "accessed": "2026-07-02" }] },
    { "category": "frontend", "tool": "Electron (VS Code fork)", "status": "current", "since": "2023", "confidence": "confirmed", "evidence": [{ "url": "https://newsletter.pragmaticengineer.com/p/cursor", "type": "interview", "quote": "The editor is a fork of Visual Studio Code", "accessed": "2026-07-02" }] },
    { "category": "database", "tool": "PostgreSQL", "status": "current", "replaced": "Yugabyte", "confidence": "confirmed", "evidence": [{ "url": "https://newsletter.pragmaticengineer.com/p/cursor", "type": "interview", "quote": "How and why Cursor moved from Yugabyte... to PostgresSQL", "accessed": "2026-07-02" }] },
    { "category": "vector-db", "tool": "Turbopuffer", "status": "current", "notes": "Encrypted files + workspace Merkle trees; emergency migration during indexing outage", "confidence": "confirmed", "evidence": [{ "url": "https://newsletter.pragmaticengineer.com/p/cursor", "type": "interview", "quote": "a multi-tenant database used to store encrypted files and the Merkle Tree of workspace", "accessed": "2026-07-02" }] },
    { "category": "vector-db", "tool": "Pinecone", "status": "current", "notes": "Documentation embeddings only", "confidence": "confirmed", "evidence": [{ "url": "https://newsletter.pragmaticengineer.com/p/cursor", "type": "interview", "quote": "a vector database storing some embeddings for documentation", "accessed": "2026-07-02" }] },
    { "category": "queue", "tool": "Warpstream", "status": "current", "confidence": "confirmed", "evidence": [{ "url": "https://newsletter.pragmaticengineer.com/p/cursor", "type": "interview", "quote": "an Apache Kafka compatible data streaming service", "accessed": "2026-07-02" }] },
    { "category": "hosting", "tool": "AWS", "status": "current", "notes": "CPU infra backbone; EC2 + Firecracker for agent isolation", "confidence": "confirmed", "evidence": [{ "url": "https://newsletter.pragmaticengineer.com/p/cursor", "type": "interview", "quote": "We mostly rely on AWS and then Azure for inference", "accessed": "2026-07-02" }] },
    { "category": "inference-infra", "tool": "Azure (H100 GPUs)", "status": "current", "notes": "Inference-only; tens of thousands of H100s overall", "confidence": "confirmed", "evidence": [{ "url": "https://newsletter.pragmaticengineer.com/p/cursor", "type": "interview", "quote": "Azure GPUs are solely for inference", "accessed": "2026-07-02" }] },
    { "category": "inference-infra", "tool": "Fireworks", "status": "current", "notes": "Hosts Fast Apply fine-tuned Llama-3-70b, ~1000 tok/s via speculative decoding", "confidence": "confirmed", "evidence": [{ "url": "https://fireworks.ai/blog/cursor", "type": "press", "quote": "Fast Apply... a 13x speedup over vanilla Llama-3-70b", "accessed": "2026-07-02" }] },
    { "category": "ml-training", "tool": "Voltage Park", "status": "current", "confidence": "confirmed", "evidence": [{ "url": "https://newsletter.pragmaticengineer.com/p/cursor", "type": "interview", "accessed": "2026-07-02" }] },
    { "category": "ml-training", "tool": "Databricks MosaicML", "status": "current", "confidence": "confirmed", "evidence": [{ "url": "https://newsletter.pragmaticengineer.com/p/cursor", "type": "interview", "accessed": "2026-07-02" }] },
    { "category": "ml-training", "tool": "Foundry", "status": "current", "confidence": "confirmed", "evidence": [{ "url": "https://newsletter.pragmaticengineer.com/p/cursor", "type": "interview", "accessed": "2026-07-02" }] },
    { "category": "llm-provider", "tool": "In-house models (Tab, Fast Apply)", "status": "current", "confidence": "confirmed", "evidence": [{ "url": "https://newsletter.pragmaticengineer.com/p/cursor", "type": "interview", "quote": "A suggestion is generated using Cursor's in-house LLM model", "accessed": "2026-07-02" }] },
    { "category": "llm-provider", "tool": "Anthropic / OpenAI / open-weight (multi-provider)", "status": "current", "confidence": "reported", "evidence": [{ "url": "https://medium.com/data-science-collective/how-cursor-actually-works-c0702d5d91a9", "type": "press", "accessed": "2026-07-02" }] },
    { "category": "hosting", "tool": "Cloudflare", "status": "current", "notes": "Reverse proxy, TLS, DDoS", "confidence": "reported", "evidence": [{ "url": "https://blog.bytebytego.com/p/how-cursor-serves-billions-of-ai", "type": "press", "accessed": "2026-07-02" }] },
    { "category": "hosting", "tool": "Vercel", "status": "current", "notes": "cursor.com website", "confidence": "confirmed", "evidence": [{ "url": "https://newsletter.pragmaticengineer.com/p/cursor", "type": "interview", "accessed": "2026-07-02" }] },
    { "category": "observability", "tool": "Datadog", "status": "current", "confidence": "confirmed", "evidence": [{ "url": "https://newsletter.pragmaticengineer.com/p/cursor", "type": "interview", "quote": "heavy users... vastly superior to the alternatives", "accessed": "2026-07-02" }] },
    { "category": "observability", "tool": "Sentry", "status": "current", "confidence": "confirmed", "evidence": [{ "url": "https://newsletter.pragmaticengineer.com/p/cursor", "type": "interview", "accessed": "2026-07-02" }] },
    { "category": "observability", "tool": "PagerDuty", "status": "current", "confidence": "confirmed", "evidence": [{ "url": "https://newsletter.pragmaticengineer.com/p/cursor", "type": "interview", "accessed": "2026-07-02" }] },
    { "category": "auth", "tool": "WorkOS", "status": "current", "confidence": "confirmed", "evidence": [{ "url": "https://newsletter.pragmaticengineer.com/p/cursor", "type": "interview", "accessed": "2026-07-02" }] },
    { "category": "payments", "tool": "Stripe", "status": "current", "confidence": "confirmed", "evidence": [{ "url": "https://newsletter.pragmaticengineer.com/p/cursor", "type": "interview", "accessed": "2026-07-02" }] },
    { "category": "analytics", "tool": "Amplitude", "status": "current", "confidence": "confirmed", "evidence": [{ "url": "https://newsletter.pragmaticengineer.com/p/cursor", "type": "interview", "accessed": "2026-07-02" }] },
    { "category": "internal-tools", "tool": "Linear", "status": "current", "confidence": "confirmed", "evidence": [{ "url": "https://newsletter.pragmaticengineer.com/p/cursor", "type": "interview", "accessed": "2026-07-02" }] },
    { "category": "internal-tools", "tool": "Slack", "status": "current", "confidence": "confirmed", "evidence": [{ "url": "https://newsletter.pragmaticengineer.com/p/cursor", "type": "interview", "accessed": "2026-07-02" }] },
    { "category": "database", "tool": "Yugabyte", "status": "previous", "replaced": "", "notes": "Migrated off to PostgreSQL", "confidence": "confirmed", "evidence": [{ "url": "https://newsletter.pragmaticengineer.com/p/cursor", "type": "interview", "accessed": "2026-07-02" }] }
  ],
  "sources": [
    "https://newsletter.pragmaticengineer.com/p/cursor",
    "https://blog.bytebytego.com/p/how-cursor-serves-billions-of-ai",
    "https://fireworks.ai/blog/cursor",
    "https://medium.com/data-science-collective/how-cursor-actually-works-c0702d5d91a9",
    "https://research.contrary.com/company/cursor"
  ]
}
